{"schema_version": 1, "adapter": "gdb-python/1", "odin_version": "", "debugger": "15.1", "source_file": "fixture.odin", "budgets": {"elements": 30, "fields": 30, "string_length": 256, "expansions_per_step": 32, "expansions_total": 600, "sane_length": 1000000, "steps": 2500}, "records": [{"index": 0, "file": "fixture.odin", "line": 24, "frames": [{"procedure": "main::main", "file": "fixture.odin", "line": 24, "depth": 0, "caller_pc": 93824992274108, "caller_sp": 140737488342064, "variables": [{"name": "notas", "value": {"state": 1, "kind": 8, "type_name": "struct []int", "reason": "declared at line 24, not reached yet"}}, {"name": "a", "value": {"state": 1, "kind": 8, "type_name": "struct main::Aluno", "reason": "declared at line 25, not reached yet"}}, {"name": "sub", "value": {"state": 1, "kind": 8, "type_name": "struct []int", "reason": "declared at line 26, not reached yet"}}, {"name": "t", "value": {"state": 1, "kind": 8, "type_name": "int", "reason": "declared at line 27, not reached yet"}}, {"name": "f", "value": {"state": 1, "kind": 8, "type_name": "int", "reason": "declared at line 28, not reached yet"}}, {"name": "no", "value": {"state": 1, "kind": 8, "type_name": "int *", "reason": "declared at line 29, not reached yet"}}]}], "returned": [], "stdout_len": 0}, {"index": 1, "file": "fixture.odin", "line": 25, "frames": [{"procedure": "main::main", "file": "fixture.odin", "line": 25, "depth": 0, "caller_pc": 93824992274108, "caller_sp": 140737488342064, "variables": [{"name": "notas", "value": {"state": 0, "kind": 2, "type_name": "struct []int", "length": 3, "data": 140737488342032, "elem_size": 8}}, {"name": "a", "value": {"state": 1, "kind": 8, "type_name": "struct main::Aluno", "reason": "declared at line 25, not reached yet"}}, {"name": "sub", "value": {"state": 1, "kind": 8, "type_name": "struct []int", "reason": "declared at line 26, not reached yet"}}, {"name": "t", "value": {"state": 1, "kind": 8, "type_name": "int", "reason": "declared at line 27, not reached yet"}}, {"name": "f", "value": {"state": 1, "kind": 8, "type_name": "int", "reason": "declared at line 28, not reached yet"}}, {"name": "no", "value": {"state": 1, "kind": 8, "type_name": "int *", "reason": "declared at line 29, not reached yet"}}]}], "returned": [], "stdout_len": 0}, {"index": 2, "file": "fixture.odin", "line": 26, "frames": [{"procedure": "main::main", "file": "fixture.odin", "line": 26, "depth": 0, "caller_pc": 93824992274108, "caller_sp": 140737488342064, "variables": [{"name": "notas", "value": {"state": 0, "kind": 2, "type_name": "struct []int", "length": 3, "data": 140737488342032, "elem_size": 8}}, {"name": "a", "value": {"state": 0, "kind": 5, "type_name": "struct main::Aluno", "members": [{"name": "nome", "value": {"state": 0, "kind": 2, "type_name": "struct string", "length": 3, "data": 93824992549669, "elem_size": 1}}, {"name": "notas", "value": {"state": 0, "kind": 2, "type_name": "struct []int", "length": 3, "data": 140737488342032, "elem_size": 8}}, {"name": "idade", "value": {"state": 0, "kind": 0, "type_name": "int", "text": "20"}}], "address": 140737488341928}}, {"name": "sub", "value": {"state": 1, "kind": 8, "type_name": "struct []int", "reason": "declared at line 26, not reached yet"}}, {"name": "t", "value": {"state": 1, "kind": 8, "type_name": "int", "reason": "declared at line 27, not reached yet"}}, {"name": "f", "value": {"state": 1, "kind": 8, "type_name": "int", "reason": "declared at line 28, not reached yet"}}, {"name": "no", "value": {"state": 1, "kind": 8, "type_name": "int *", "reason": "declared at line 29, not reached yet"}}]}], "returned": [], "stdout_len": 0}, {"index": 3, "file": "fixture.odin", "line": 26, "frames": [{"procedure": "main::main", "file": "fixture.odin", "line": 26, "depth": 0, "caller_pc": 93824992274108, "caller_sp": 140737488342064, "variables": [{"name": "notas", "value": {"state": 0, "kind": 2, "type_name": "struct []int", "length": 3, "data": 140737488342032, "elem_size": 8}}, {"name": "a", "value": {"state": 0, "kind": 5, "type_name": "struct main::Aluno", "members": [{"name": "nome", "value": {"state": 0, "kind": 2, "type_name": "struct string", "length": 3, "data": 93824992549669, "elem_size": 1}}, {"name": "notas", "value": {"state": 0, "kind": 2, "type_name": "struct []int", "length": 3, "data": 140737488342032, "elem_size": 8}}, {"name": "idade", "value": {"state": 0, "kind": 0, "type_name": "int", "text": "20"}}], "address": 140737488341928}}, {"name": "sub", "value": {"state": 1, "kind": 8, "type_name": "struct []int", "reason": "declared at line 26, not reached yet"}}, {"name": "t", "value": {"state": 1, "kind": 8, "type_name": "int", "reason": "declared at line 27, not reached yet"}}, {"name": "f", "value": {"state": 1, "kind": 8, "type_name": "int", "reason": "declared at line 28, not reached yet"}}, {"name": "no", "value": {"state": 1, "kind": 8, "type_name": "int *", "reason": "declared at line 29, not reached yet"}}]}], "returned": [], "stdout_len": 0}, {"index": 4, "file": "fixture.odin", "line": 27, "frames": [{"procedure": "main::main", "file": "fixture.odin", "line": 27, "depth": 0, "caller_pc": 93824992274108, "caller_sp": 140737488342064, "variables": [{"name": "notas", "value": {"state": 0, "kind": 2, "type_name": "struct []int", "length": 3, "data": 140737488342032, "elem_size": 8}}, {"name": "a", "value": {"state": 0, "kind": 5, "type_name": "struct main::Aluno", "members": [{"name": "nome", "value": {"state": 0, "kind": 2, "type_name": "struct string", "length": 3, "data": 93824992549669, "elem_size": 1}}, {"name": "notas", "value": {"state": 0, "kind": 2, "type_name": "struct []int", "length": 3, "data": 140737488342032, "elem_size": 8}}, {"name": "idade", "value": {"state": 0, "kind": 0, "type_name": "int", "text": "20"}}], "address": 140737488341928}}, {"name": "sub", "value": {"state": 0, "kind": 2, "type_name": "struct []int", "length": 2, "data": 140737488342040, "elem_size": 8}}, {"name": "t", "value": {"state": 1, "kind": 8, "type_name": "int", "reason": "declared at line 27, not reached yet"}}, {"name": "f", "value": {"state": 1, "kind": 8, "type_name": "int", "reason": "declared at line 28, not reached yet"}}, {"name": "no", "value": {"state": 1, "kind": 8, "type_name": "int *", "reason": "declared at line 29, not reached yet"}}]}], "returned": [], "stdout_len": 0}, {"index": 5, "file": "fixture.odin", "line": 10, "frames": [{"procedure": "main::soma", "file": "fixture.odin", "line": 10, "depth": 0, "caller_pc": 93824992358310, "caller_sp": 140737488341696, "variables": [{"name": "xs", "value": {"state": 1, "kind": 8, "type_name": "struct []int", "reason": "declared at line 10, not reached yet"}}]}, {"procedure": "main::main", "file": "fixture.odin", "line": 27, "depth": 1, "caller_pc": 93824992274108, "caller_sp": 140737488342064, "variables": [{"name": "notas", "value": {"state": 0, "kind": 2, "type_name": "struct []int", "length": 3, "data": 140737488342032, "elem_size": 8}}, {"name": "a", "value": {"state": 0, "kind": 5, "type_name": "struct main::Aluno", "members": [{"name": "nome", "value": {"state": 0, "kind": 2, "type_name": "struct string", "length": 3, "data": 93824992549669, "elem_size": 1}}, {"name": "notas", "value": {"state": 0, "kind": 2, "type_name": "struct []int", "length": 3, "data": 140737488342032, "elem_size": 8}}, {"name": "idade", "value": {"state": 0, "kind": 0, "type_name": "int", "text": "20"}}], "address": 140737488341928}}, {"name": "sub", "value": {"state": 0, "kind": 2, "type_name": "struct []int", "length": 2, "data": 140737488342040, "elem_size": 8}}, {"name": "t", "value": {"state": 1, "kind": 8, "type_name": "int", "reason": "declared at line 27, not reached yet"}}, {"name": "f", "value": {"state": 1, "kind": 8, "type_name": "int", "reason": "declared at line 28, not reached yet"}}, {"name": "no", "value": {"state": 1, "kind": 8, "type_name": "int *", "reason": "declared at line 29, not reached yet"}}]}], "returned": [], "stdout_len": 0}, {"index": 6, "file": "fixture.odin", "line": 11, "frames": [{"procedure": "main::soma", "file": "fixture.odin", "line": 11, "depth": 0, "caller_pc": 93824992358310, "caller_sp": 140737488341696, "variables": [{"name": "total", "value": {"state": 1, "kind": 8, "type_name": "int", "reason": "declared at line 11, not reached yet"}}, {"name": "xs", "value": {"state": 0, "kind": 2, "type_name": "struct []int", "length": 3, "data": 140737488342032, "elem_size": 8}}]}, {"procedure": "main::main", "file": "fixture.odin", "line": 27, "depth": 1, "caller_pc": 93824992274108, "caller_sp": 140737488342064, "variables": [{"name": "notas", "value": {"state": 0, "kind": 2, "type_name": "struct []int", "length": 3, "data": 140737488342032, "elem_size": 8}}, {"name": "a", "value": {"state": 0, "kind": 5, "type_name": "struct main::Aluno", "members": [{"name": "nome", "value": {"state": 0, "kind": 2, "type_name": "struct string", "length": 3, "data": 93824992549669, "elem_size": 1}}, {"name": "notas", "value": {"state": 0, "kind": 2, "type_name": "struct []int", "length": 3, "data": 140737488342032, "elem_size": 8}}, {"name": "idade", "value": {"state": 0, "kind": 0, "type_name": "int", "text": "20"}}], "address": 140737488341928}}, {"name": "sub", "value": {"state": 0, "kind": 2, "type_name": "struct []int", "length": 2, "data": 140737488342040, "elem_size": 8}}, {"name": "t", "value": {"state": 1, "kind": 8, "type_name": "int", "reason": "declared at line 27, not reached yet"}}, {"name": "f", "value": {"state": 1, "kind": 8, "type_name": "int", "reason": "declared at line 28, not reached yet"}}, {"name": "no", "value": {"state": 1, "kind": 8, "type_name": "int *", "reason": "declared at line 29, not reached yet"}}]}], "returned": [], "stdout_len": 0}, {"index": 7, "file": "fixture.odin", "line": 12, "frames": [{"procedure": "main::soma", "file": "fixture.odin", "line": 12, "depth": 0, "caller_pc": 93824992358310, "caller_sp": 140737488341696, "variables": [{"name": "total", "va